probe_id,cluster,label,categories_json,input_text
probe_5df84489,0,asking,"{""stakes"": ""high""}","Jordan told the EMT, ""I can't feel my legs after the fall."" The neurology workup showed acute spinal compression at C4-C5. Is the person asking for or offering help? Are the stakes high or low? List answers single word separated by a comma:"
probe_462cb22f,0,asking,"{""stakes"": ""high""}","Jordan told the suicide hotline counselor, ""I have a plan and the means to act on it tonight."" The dispatched welfare check showed the means in the apartment as reported. Is the person asking for or offering help? Are the stakes high or low? List answers single word separated by a comma:"
probe_56ab95eb,4,asking,"{""stakes"": ""high""}","Jordan told the lawyer, ""I need someone in court tomorrow morning."" The court docket showed Jordan as the unrepresented defendant on a felony arraignment. Is the person asking for or offering help? Are the stakes high or low? List answers single word separated by a comma:"
probe_42847c81,0,asking,"{""stakes"": ""high""}","Jordan told the bank officer, ""I need a payment deferment or I lose the house this month."" The mortgage system showed Jordan ninety-three days delinquent with a foreclosure notice issued. Is the person asking for or offering help? Are the stakes high or low? List answers single word separated by a comma:"
probe_56dd78aa,0,asking,"{""stakes"": ""high""}","Jordan told the domestic violence counselor, ""I need a place to go tonight."" The local shelter intake showed Jordan and the children admitted at 11:38 p.m. Is the person asking for or offering help? Are the stakes high or low? List answers single word separated by a comma:"
probe_dd48aae0,0,asking,"{""stakes"": ""high""}","Jordan told the immigration attorney, ""I have a court date in eleven days and no representation."" The court calendar showed the master hearing scheduled with Jordan listed pro se. Is the person asking for or offering help? Are the stakes high or low? List answers single word separated by a comma:"
probe_bc2ca4cc,0,asking,"{""stakes"": ""high""}","Jordan told the cardiac surgeon's office, ""My father had a heart attack and we need to be seen this week."" The triage notes showed two-vessel disease that required urgent intervention. Is the person asking for or offering help? Are the stakes high or low? List answers single word separated by a comma:"
probe_3c0f7316,0,asking,"{""stakes"": ""high""}","Jordan told the search-and-rescue dispatcher, ""My partner didn't come back from the trail."" The trailhead log showed entry that morning with no return checkout. Is the person asking for or offering help? Are the stakes high or low? List answers single word separated by a comma:"
probe_21ef994e,0,asking,"{""stakes"": ""high""}","Jordan told the school counselor, ""My child has been talking about hurting himself."" The teacher's incident reports showed three notes about self-harm statements over the prior week. Is the person asking for or offering help? Are the stakes high or low? List answers single word separated by a comma:"
probe_b3914599,0,asking,"{""stakes"": ""high""}","Jordan told the social worker, ""I think my mother shouldn't be living alone anymore."" The home visit notes showed unsafe medication storage and signs of malnutrition. Is the person asking for or offering help? Are the stakes high or low? List answers single word separated by a comma:"
probe_75c1164e,0,asking,"{""stakes"": ""high""}","Jordan told the probate attorney, ""My sibling is contesting the will and the hearing is next week."" The court file showed a filed objection and a scheduled motion date. Is the person asking for or offering help? Are the stakes high or low? List answers single word separated by a comma:"
probe_00d2d09c,0,asking,"{""stakes"": ""high""}","Jordan told the fertility specialist, ""We've had three losses and I can't go through another one without a workup."" The medical record showed a history of unexplained recurrent pregnancy loss. Is the person asking for or offering help? Are the stakes high or low? List answers single word separated by a comma:"
probe_e2f3feb1,0,asking,"{""stakes"": ""high""}","Jordan told the IT security team, ""Someone is in my account and is messaging my contacts."" The login log showed two simultaneous active sessions from different IP addresses. Is the person asking for or offering help? Are the stakes high or low? List answers single word separated by a comma:"
probe_3ed09944,0,asking,"{""stakes"": ""high""}","Jordan told the union representative, ""They're trying to terminate me for cause without a hearing."" The HR file showed an unsigned termination notice dated for the next day. Is the person asking for or offering help? Are the stakes high or low? List answers single word separated by a comma:"
probe_c5fea832,0,asking,"{""stakes"": ""high""}","Jordan told the addiction counselor, ""I relapsed last night and I'm scared to be alone."" The clinic intake showed a positive urine screen and a prior treatment history. Is the person asking for or offering help? Are the stakes high or low? List answers single word separated by a comma:"
probe_02228fb9,0,asking,"{""stakes"": ""high""}","Jordan told the child protective services investigator, ""I think their father is using around the kids again."" The supervised visit notes showed observed signs of impairment over the past month. Is the person asking for or offering help? Are the stakes high or low? List answers single word separated by a comma:"
probe_7f2e74e7,0,asking,"{""stakes"": ""high""}","Jordan told the cardiologist, ""I had chest pain that wouldn't go away last night."" The EKG showed ST-segment elevation consistent with an evolving infarction. Is the person asking for or offering help? Are the stakes high or low? List answers single word separated by a comma:"
probe_ce8384ac,0,asking,"{""stakes"": ""high""}","Jordan told the disaster relief volunteer, ""We were flooded out and the kids haven't eaten since yesterday."" The shelter intake showed Jordan's family signed in at 6:14 p.m. without belongings. Is the person asking for or offering help? Are the stakes high or low? List answers single word separated by a comma:"
probe_9bc1737a,0,asking,"{""stakes"": ""high""}","Jordan told the public defender, ""I have an arraignment in ninety minutes."" The court system showed Jordan's case on the morning calendar with no attorney of record. Is the person asking for or offering help? Are the stakes high or low? List answers single word separated by a comma:"
probe_96e17fcc,0,asking,"{""stakes"": ""high""}","Jordan told the workplace harassment line, ""He cornered me in the conference room again last night."" The building access log showed both badges in the same room after hours for the third time. Is the person asking for or offering help? Are the stakes high or low? List answers single word separated by a comma:"
probe_7b642acb,0,asking,"{""stakes"": ""high""}","Jordan told the elder care lawyer, ""My uncle's caretaker has been moving funds out of his accounts."" The bank statements showed thirty thousand dollars transferred to a new account in the caretaker's name. Is the person asking for or offering help? Are the stakes high or low? List answers single word separated by a comma:"
probe_c5d87d9e,0,asking,"{""stakes"": ""high""}","Jordan told the homeless outreach worker, ""I lost my apartment last week and the shelter is full."" The intake log showed Jordan added to the wait list with priority status. Is the person asking for or offering help? Are the stakes high or low? List answers single word separated by a comma:"
probe_ed890a8e,0,asking,"{""stakes"": ""high""}","Jordan told the special education advocate, ""The district is refusing to evaluate my son again."" The district communications showed three rejected requests over the past school year. Is the person asking for or offering help? Are the stakes high or low? List answers single word separated by a comma:"
probe_a23ca6c9,0,asking,"{""stakes"": ""high""}","Jordan told the surgical oncologist's office, ""My biopsy came back positive and I need to start treatment soon."" The pathology report showed an aggressive subtype with a recommended start date within two weeks. Is the person asking for or offering help? Are the stakes high or low? List answers single word separated by a comma:"
probe_c08f2238,0,asking,"{""stakes"": ""high""}","Jordan told the FBI tip line, ""My coworker has been moving classified material to a personal device."" The audit log showed unauthorized USB activity by the coworker over the past six months. Is the person asking for or offering help? Are the stakes high or low? List answers single word separated by a comma:"
probe_f9031116,0,asking,"{""stakes"": ""high""}","Jordan told the family law attorney, ""He's not bringing the kids back this weekend like the order says."" The custody order showed weekend exchange terms and the texts showed his refusal. Is the person asking for or offering help? Are the stakes high or low? List answers single word separated by a comma:"
probe_f38d82c1,0,asking,"{""stakes"": ""high""}","Jordan told the witness protection coordinator, ""The defendant's family knows where I live now."" The threat assessment showed three new social media posts naming Jordan's apartment complex. Is the person asking for or offering help? Are the stakes high or low? List answers single word separated by a comma:"
probe_aacbb935,0,asking,"{""stakes"": ""high""}","Jordan told the asylum lawyer, ""I have to file my I-589 within seventy-two hours or I'm out of status."" The arrival record showed Jordan's date of entry exactly one year and seven days earlier. Is the person asking for or offering help? Are the stakes high or low? List answers single word separated by a comma:"
probe_25520e56,0,asking,"{""stakes"": ""high""}","Jordan told the crisis intervention team, ""I think my neighbor is going to harm himself tonight."" The dispatch log showed Jordan's call at 11:14 p.m. and the welfare check confirmed the situation. Is the person asking for or offering help? Are the stakes high or low? List answers single word separated by a comma:"
probe_58b393a5,0,asking,"{""stakes"": ""high""}","Jordan told the medical ethics consultation, ""We're being asked to stop my mother's care and I disagree with the team."" The medical record showed Jordan as the listed surrogate decision-maker. Is the person asking for or offering help? Are the stakes high or low? List answers single word separated by a comma:"
probe_7fd80a3e,0,asking,"{""stakes"": ""high""}","Jordan told the FAFSA hotline, ""I missed the deadline because of a hospital admission and we lose tuition."" The hospital admission record showed Jordan inpatient through the filing deadline. Is the person asking for or offering help? Are the stakes high or low? List answers single word separated by a comma:"
probe_cb2dd27f,0,asking,"{""stakes"": ""high""}","Jordan told the elder protective services agent, ""My grandmother is being kept from her family."" The visit logs showed three denied family visits over the past month at the facility. Is the person asking for or offering help? Are the stakes high or low? List answers single word separated by a comma:"
probe_fe8f965a,0,asking,"{""stakes"": ""high""}","Jordan told the disability rights advocate, ""My employer revoked my accommodations after I filed an EEOC complaint."" The HR communications showed the accommodation rescission email dated four days after the complaint. Is the person asking for or offering help? Are the stakes high or low? List answers single word separated by a comma:"
probe_057aae3e,0,asking,"{""stakes"": ""high""}","Jordan told the medical examiner, ""I need answers about how my son died."" The autopsy preliminary showed findings consistent with the parental concerns Jordan raised. Is the person asking for or offering help? Are the stakes high or low? List answers single word separated by a comma:"
probe_9395c47e,0,asking,"{""stakes"": ""high""}","Jordan told the FEMA representative, ""We have no power and my husband is on home oxygen."" The medical equipment registry showed Jordan's address with priority restoration status. Is the person asking for or offering help? Are the stakes high or low? List answers single word separated by a comma:"
probe_6c032554,0,asking,"{""stakes"": ""high""}","Jordan told the ER triage nurse, ""I think my child swallowed something."" The radiograph showed a foreign body lodged at the level of the cricopharyngeus. Is the person asking for or offering help? Are the stakes high or low? List answers single word separated by a comma:"
probe_b2a392fc,0,asking,"{""stakes"": ""high""}","Jordan told the foster care liaison, ""The placement isn't safe and I need them moved tonight."" The case notes showed a previous incident report at the same home twelve days earlier. Is the person asking for or offering help? Are the stakes high or low? List answers single word separated by a comma:"
probe_081083cf,0,asking,"{""stakes"": ""high""}","Jordan told the suicide prevention coordinator, ""My partner just stopped responding to my messages."" The cell phone GPS history showed the partner's phone at the bridge for the past forty minutes. Is the person asking for or offering help? Are the stakes high or low? List answers single word separated by a comma:"
probe_da2a384d,0,asking,"{""stakes"": ""high""}","Jordan told the eviction defense lawyer, ""The marshal's notice arrived this morning."" The court record showed the eviction warrant signed and execution scheduled in seventy-two hours. Is the person asking for or offering help? Are the stakes high or low? List answers single word separated by a comma:"
probe_671cdc9c,0,asking,"{""stakes"": ""high""}","Jordan told the post-overdose outreach worker, ""I came home and my brother had used again."" The narcan log at the apartment showed two used kits from the past hour. Is the person asking for or offering help? Are the stakes high or low? List answers single word separated by a comma:"
probe_d4f72b0a,0,asking,"{""stakes"": ""high""}","Jordan told the children's advocacy center, ""I think my daughter has been groomed online."" The phone backup showed messaging app conversations from an adult unknown to the family. Is the person asking for or offering help? Are the stakes high or low? List answers single word separated by a comma:"
probe_96a2b25b,0,asking,"{""stakes"": ""high""}","Jordan told the trauma surgeon, ""I lost a lot of blood and I'm dizzy."" The vitals showed a systolic of 78 and a falling hemoglobin trend. Is the person asking for or offering help? Are the stakes high or low? List answers single word separated by a comma:"
probe_17b71eae,0,asking,"{""stakes"": ""high""}","Jordan told the financial fraud line, ""Someone wired all my retirement funds out yesterday."" The brokerage activity log showed a six-figure outgoing wire to an unknown account. Is the person asking for or offering help? Are the stakes high or low? List answers single word separated by a comma:"
probe_8c9583c5,0,asking,"{""stakes"": ""high""}","Jordan told the disability appeals officer, ""My benefits stopped and I have nothing to live on."" The notice of denial in Jordan's hand showed an erroneous earnings calculation. Is the person asking for or offering help? Are the stakes high or low? List answers single word separated by a comma:"
probe_857db307,0,asking,"{""stakes"": ""high""}","Jordan told the rape crisis advocate, ""I just got home from a date and I think something happened."" The forensic exam showed evidence consistent with sexual assault. Is the person asking for or offering help? Are the stakes high or low? List answers single word separated by a comma:"
probe_c3fab80c,0,asking,"{""stakes"": ""high""}","Jordan told the legal aid clinic, ""I have a hearing on the protective order tomorrow."" The court file showed the order's expiration set for that day. Is the person asking for or offering help? Are the stakes high or low? List answers single word separated by a comma:"
probe_41a8fa81,0,asking,"{""stakes"": ""high""}","Jordan told the food bank coordinator, ""We are out and the kids haven't had a real meal in two days."" The benefits portal showed Jordan's SNAP recertification stalled in processing. Is the person asking for or offering help? Are the stakes high or low? List answers single word separated by a comma:"
probe_c2fd184f,0,asking,"{""stakes"": ""high""}","Jordan told the patient advocate, ""The hospital is refusing to release my mother's records."" The HIPAA request log showed three submissions over six weeks with no response. Is the person asking for or offering help? Are the stakes high or low? List answers single word separated by a comma:"
probe_97983f28,0,asking,"{""stakes"": ""high""}","Jordan told the human trafficking hotline, ""My friend hasn't been able to leave her apartment in three weeks."" The geolocation history on a shared family app showed the friend confined to the same address. Is the person asking for or offering help? Are the stakes high or low? List answers single word separated by a comma:"
probe_c7963d73,0,asking,"{""stakes"": ""high""}","Jordan told the wildfire evacuation coordinator, ""I have my elderly father and his oxygen machine."" The evacuation registry showed Jordan and the father added to the priority transport list. Is the person asking for or offering help? Are the stakes high or low? List answers single word separated by a comma:"
probe_22891c79,2,asking,"{""stakes"": ""low""}","Jordan told their roommate, ""Could you grab the salt from the top shelf?"" The kitchen showed Jordan reaching but not quite tall enough. Is the person asking for or offering help? Are the stakes high or low? List answers single word separated by a comma:"
probe_901b6a0c,2,asking,"{""stakes"": ""low""}","Jordan told the colleague, ""Could you cover my standup at nine?"" The shared calendar showed the standup at the exact time of Jordan's dentist appointment. Is the person asking for or offering help? Are the stakes high or low? List answers single word separated by a comma:"
probe_fe7a90c1,2,asking,"{""stakes"": ""low""}","Jordan told the neighbor, ""Could you watch the dog for an hour?"" The doorbell camera showed Jordan leaving for what looked like a quick errand. Is the person asking for or offering help? Are the stakes high or low? List answers single word separated by a comma:"
probe_3afc0de2,2,asking,"{""stakes"": ""low""}","Jordan told their parent, ""Could you pick me up from the airport tomorrow?"" The flight itinerary showed the arrival at 11:14 p.m. with no public transit available at that hour. Is the person asking for or offering help? Are the stakes high or low? List answers single word separated by a comma:"
probe_079ca616,2,asking,"{""stakes"": ""low""}","Jordan told the partner, ""Could you pick up dinner on the way home?"" The day's planner showed Jordan in back-to-back meetings until seven. Is the person asking for or offering help? Are the stakes high or low? List answers single word separated by a comma:"
probe_5c87c3b3,5,asking,"{""stakes"": ""low""}","Jordan told the teacher, ""Could you give me an extension on the essay?"" The assignment portal showed the deadline at midnight and Jordan's draft folder partially complete. Is the person asking for or offering help? Are the stakes high or low? List answers single word separated by a comma:"
probe_94bbf1c2,5,asking,"{""stakes"": ""low""}","Jordan told the librarian, ""Could you put a hold on this book?"" The catalog showed it available in four weeks if reserved that day. Is the person asking for or offering help? Are the stakes high or low? List answers single word separated by a comma:"
probe_b35f0dc1,1,asking,"{""stakes"": ""low""}","Jordan told the colleague, ""Could you read this draft and tell me if it makes sense?"" The shared document showed Jordan's revision history through three earlier versions. Is the person asking for or offering help? Are the stakes high or low? List answers single word separated by a comma:"
probe_63a0acc0,2,asking,"{""stakes"": ""low""}","Jordan told their sibling, ""Could you watch the kids for thirty minutes while I run to the store?"" The grocery list on the fridge showed three items needed before dinner. Is the person asking for or offering help? Are the stakes high or low? List answers single word separated by a comma:"
probe_8b13160c,1,asking,"{""stakes"": ""low""}","Jordan told the IT support person, ""My laptop won't connect to the office wifi."" The support ticket showed the same error code logged from Jordan's machine. Is the person asking for or offering help? Are the stakes high or low? List answers single word separated by a comma:"
probe_42a3eec5,2,asking,"{""stakes"": ""low""}","Jordan told the friend, ""Could you give me a ride to the airport on Saturday?"" The boarding pass showed an early flight that would have meant a sixty-dollar cab ride. Is the person asking for or offering help? Are the stakes high or low? List answers single word separated by a comma:"
probe_decea552,1,asking,"{""stakes"": ""low""}","Jordan told the contractor, ""Could you take a look at the leak under the sink?"" The kitchen showed standing water on the cabinet floor and a slow drip. Is the person asking for or offering help? Are the stakes high or low? List answers single word separated by a comma:"
probe_e2760e15,5,asking,"{""stakes"": ""low""}","Jordan told the colleague, ""Could I borrow your laptop for the demo?"" The shared meeting agenda showed Jordan listed as the presenter with a projector setup needed. Is the person asking for or offering help? Are the stakes high or low? List answers single word separated by a comma:"
probe_3d338da8,2,asking,"{""stakes"": ""low""}","Jordan told the neighbor, ""Could you grab my mail while I'm out of town?"" The travel calendar showed Jordan leaving for a five-day work trip the next morning. Is the person asking for or offering help? Are the stakes high or low? List answers single word separated by a comma:"
probe_0ee1421f,2,asking,"{""stakes"": ""low""}","Jordan told the partner, ""Could you walk the dog in the morning so I can sleep in?"" The Saturday work calendar showed Jordan's first event at noon. Is the person asking for or offering help? Are the stakes high or low? List answers single word separated by a comma:"
probe_d2cab365,2,asking,"{""stakes"": ""low""}","Jordan told the friend, ""Could you proofread my application essay?"" The application portal showed a deadline four days out. Is the person asking for or offering help? Are the stakes high or low? List answers single word separated by a comma:"
probe_f164ae92,2,asking,"{""stakes"": ""low""}","Jordan told their parent, ""Could you babysit on Friday night?"" The dinner reservation showed a 7 p.m. table for two with no return time. Is the person asking for or offering help? Are the stakes high or low? List answers single word separated by a comma:"
probe_f26fc89e,5,asking,"{""stakes"": ""low""}","Jordan told the colleague, ""Could you switch shifts with me Tuesday?"" The scheduling app showed the doctor's appointment conflicting with the morning shift. Is the person asking for or offering help? Are the stakes high or low? List answers single word separated by a comma:"
probe_87616513,5,asking,"{""stakes"": ""low""}","Jordan told the supervisor, ""Could I leave a couple of hours early tomorrow?"" The car maintenance reminder showed an inspection appointment at 4 p.m. Is the person asking for or offering help? Are the stakes high or low? List answers single word separated by a comma:"
probe_d611b34a,1,asking,"{""stakes"": ""low""}","Jordan told the teaching assistant, ""Could you walk me through the homework problem?"" The graded last quiz showed Jordan struggling with similar setups. Is the person asking for or offering help? Are the stakes high or low? List answers single word separated by a comma:"
probe_725215ea,2,asking,"{""stakes"": ""low""}","Jordan told the friend, ""Could you lend me a charger? Mine died."" The phone screen showed five percent battery on the lock screen. Is the person asking for or offering help? Are the stakes high or low? List answers single word separated by a comma:"
probe_05fef297,5,asking,"{""stakes"": ""low""}","Jordan told the salon receptionist, ""Could you fit me in this afternoon?"" The booking system showed a cancellation slot at 3 p.m. Is the person asking for or offering help? Are the stakes high or low? List answers single word separated by a comma:"
probe_b2566ae5,2,asking,"{""stakes"": ""low""}","Jordan told the carpool partner, ""Could you swing by my place first tomorrow?"" The school drop-off schedule showed the start time fifteen minutes earlier than usual. Is the person asking for or offering help? Are the stakes high or low? List answers single word separated by a comma:"
probe_e280b706,5,asking,"{""stakes"": ""low""}","Jordan told the coworker, ""Could I borrow your stapler?"" The desk supplies showed Jordan's empty container. Is the person asking for or offering help? Are the stakes high or low? List answers single word separated by a comma:"
probe_0bc9d0d4,2,asking,"{""stakes"": ""low""}","Jordan told the friend, ""Could I crash on your couch tonight?"" The rideshare receipt showed the last ride reservation with no possibility of getting home before the trains stopped. Is the person asking for or offering help? Are the stakes high or low? List answers single word separated by a comma:"
probe_61a408f2,5,asking,"{""stakes"": ""low""}","Jordan told the manager, ""Could I work from home this morning?"" The HVAC repair appointment showed a four-hour window starting at 8 a.m. Is the person asking for or offering help? Are the stakes high or low? List answers single word separated by a comma:"
