probe_id,cluster,label,categories_json,input_text
probe_d5c1c4b6,1,offering,"{""stakes"": ""low""}","Jordan told the colleague at the printer, ""Let me take a look at that jam."" The maintenance log showed Jordan clearing the rear roller on the same machine three times that month. Is the person asking for or offering help? Are the stakes high or low? List answers single word separated by a comma:"
probe_a08096bd,1,offering,"{""stakes"": ""low""}","Jordan told the partner balancing groceries, ""Let me grab a couple of those bags."" The kitchen counter showed five bags placed by Jordan. Is the person asking for or offering help? Are the stakes high or low? List answers single word separated by a comma:"
probe_4c1085e4,1,offering,"{""stakes"": ""low""}","Jordan told the teen at the corner, ""I'm going your direction if you want a ride."" The dashcam showed the teen getting in and out at the next intersection. Is the person asking for or offering help? Are the stakes high or low? List answers single word separated by a comma:"
probe_600a05e5,1,offering,"{""stakes"": ""low""}","Jordan told the new colleague, ""I'll show you where the coffee is."" The office camera showed Jordan walking the colleague to the kitchen and pointing things out. Is the person asking for or offering help? Are the stakes high or low? List answers single word separated by a comma:"
probe_cce0210e,1,offering,"{""stakes"": ""low""}","Jordan told the older neighbor with the broken light, ""I'll change that bulb for you."" The maintenance receipt showed Jordan picking up a sixty-watt LED on the way home. Is the person asking for or offering help? Are the stakes high or low? List answers single word separated by a comma:"
probe_6d5fffa2,1,offering,"{""stakes"": ""low""}","Jordan told their roommate juggling laundry, ""I'll fold yours when you're done."" The clean laundry bin showed Jordan's neat folded stacks of two loads. Is the person asking for or offering help? Are the stakes high or low? List answers single word separated by a comma:"
probe_34d35bc6,1,offering,"{""stakes"": ""low""}","Jordan told the visiting cousin, ""I'll drive you to the airport tomorrow morning."" The travel itinerary showed Jordan's calendar blocked from 5 to 7 a.m. for the run. Is the person asking for or offering help? Are the stakes high or low? List answers single word separated by a comma:"
probe_8cc8b121,1,offering,"{""stakes"": ""low""}","Jordan told the colleague late on the deck, ""I'll handle the slides if you want to take a break."" The presentation revision history showed Jordan editing pages 12 through 18 that evening. Is the person asking for or offering help? Are the stakes high or low? List answers single word separated by a comma:"
probe_050f7e7f,1,offering,"{""stakes"": ""low""}","Jordan told the partner mid-cold, ""I'll make soup tonight."" The kitchen showed the cutting board with carrots and celery and a pot warming on low. Is the person asking for or offering help? Are the stakes high or low? List answers single word separated by a comma:"
probe_43860388,1,offering,"{""stakes"": ""low""}","Jordan told the friend whose phone had died, ""Use mine to call them."" The call log showed an outgoing seven-minute call from Jordan's number to the friend's spouse. Is the person asking for or offering help? Are the stakes high or low? List answers single word separated by a comma:"
probe_465b1c9b,1,offering,"{""stakes"": ""low""}","Jordan told the neighbor with the heavy package, ""I'll grab one end of it for you."" The hallway camera showed both of them carrying the box together. Is the person asking for or offering help? Are the stakes high or low? List answers single word separated by a comma:"
probe_f13f4fd2,1,offering,"{""stakes"": ""low""}","Jordan told their friend stuck in traffic, ""I'll grab your kid from school."" The pickup sign-out showed Jordan's name on the school's afternoon log. Is the person asking for or offering help? Are the stakes high or low? List answers single word separated by a comma:"
probe_7a137685,1,offering,"{""stakes"": ""low""}","Jordan told the manager during the all-hands prep, ""Let me handle the AV setup."" The conference room log showed Jordan setting up the projector and microphones at 8:12 a.m. Is the person asking for or offering help? Are the stakes high or low? List answers single word separated by a comma:"
probe_37272c27,1,offering,"{""stakes"": ""low""}","Jordan told the elderly customer at the coffee shop, ""Let me pay for that one."" The receipt showed Jordan's card covering both orders. Is the person asking for or offering help? Are the stakes high or low? List answers single word separated by a comma:"
probe_84fa80e1,1,offering,"{""stakes"": ""low""}","Jordan told the colleague with the spreadsheet, ""I'll fix that pivot table — I've done this before."" The shared file's revision history showed Jordan's edits on the analysis tab. Is the person asking for or offering help? Are the stakes high or low? List answers single word separated by a comma:"
probe_290201fd,1,offering,"{""stakes"": ""low""}","Jordan told their new tenant, ""Let me know if anything in the apartment is off — I'll handle it."" The first-month maintenance ticket showed three items resolved by Jordan within a week. Is the person asking for or offering help? Are the stakes high or low? List answers single word separated by a comma:"
probe_848b2cbc,1,offering,"{""stakes"": ""low""}","Jordan told the coworker with the flat tire, ""I have a spare jack in my trunk."" The dashcam showed Jordan walking around to the lot with the equipment. Is the person asking for or offering help? Are the stakes high or low? List answers single word separated by a comma:"
probe_b32cc9ad,1,offering,"{""stakes"": ""low""}","Jordan told the parent at the park, ""I'll grab your stroller while you take her in."" The phone photos showed Jordan returning with the stroller a few minutes later. Is the person asking for or offering help? Are the stakes high or low? List answers single word separated by a comma:"
probe_5618ba43,1,offering,"{""stakes"": ""low""}","Jordan told the friend planning a birthday, ""I'll bring the cake."" The bakery receipt showed Jordan picking up a pre-ordered cake on the day. Is the person asking for or offering help? Are the stakes high or low? List answers single word separated by a comma:"
probe_a3e7ad8b,1,offering,"{""stakes"": ""low""}","Jordan told the manager during the team move, ""I'll take the late truck shift if you need."" The moving company schedule showed Jordan listed for the 10 p.m. unload. Is the person asking for or offering help? Are the stakes high or low? List answers single word separated by a comma:"
probe_1671462c,1,offering,"{""stakes"": ""low""}","Jordan told the receptionist swamped at the desk, ""I can answer that line for the next ten minutes."" The call log showed Jordan handling four calls in the busy window. Is the person asking for or offering help? Are the stakes high or low? List answers single word separated by a comma:"
probe_abcbfae6,1,offering,"{""stakes"": ""low""}","Jordan told the parent before the school play, ""I'll record it on my phone for you."" The cloud storage showed a forty-minute video shared with the parent the next day. Is the person asking for or offering help? Are the stakes high or low? List answers single word separated by a comma:"
probe_c81b02f8,5,offering,"{""stakes"": ""low""}","Jordan told the friend training for a half-marathon, ""I'll come run the long ones with you on Saturdays."" The fitness app showed two paired workouts of nine and ten miles in consecutive weeks. Is the person asking for or offering help? Are the stakes high or low? List answers single word separated by a comma:"
probe_9896adba,1,offering,"{""stakes"": ""low""}","Jordan told the couple who'd just had a baby, ""I'll drop off dinner Tuesday."" The thank-you note showed Jordan's lasagna received that day. Is the person asking for or offering help? Are the stakes high or low? List answers single word separated by a comma:"
probe_73c5f29d,1,offering,"{""stakes"": ""low""}","Jordan told the colleague learning the codebase, ""I'll pair on the next ticket with you."" The git log showed co-authored commits on a four-day project the following week. Is the person asking for or offering help? Are the stakes high or low? List answers single word separated by a comma:"
probe_feb93ba2,1,offering,"{""stakes"": ""low""}","Jordan told the cousin moving apartments, ""I'll bring the truck on Saturday."" The U-Haul rental showed Jordan as the driver for the eight-hour rental. Is the person asking for or offering help? Are the stakes high or low? List answers single word separated by a comma:"
probe_c2f92848,1,offering,"{""stakes"": ""low""}","Jordan told the kid at the bus stop without a snack, ""I have an extra granola bar."" The phone photos showed the kid walking to school with the bar in hand. Is the person asking for or offering help? Are the stakes high or low? List answers single word separated by a comma:"
probe_5387d39e,5,offering,"{""stakes"": ""low""}","Jordan told the friend's parent visiting town, ""I'll show you around the museum."" The phone camera roll showed photos of the two of them at four exhibits. Is the person asking for or offering help? Are the stakes high or low? List answers single word separated by a comma:"
probe_f2e20c13,1,offering,"{""stakes"": ""low""}","Jordan told the new homeowner neighbor, ""I'll lend you my drill if you need."" The garage log showed the drill missing for two weeks and returned with a thank-you note. Is the person asking for or offering help? Are the stakes high or low? List answers single word separated by a comma:"
probe_e501f429,1,offering,"{""stakes"": ""low""}","Jordan told the parent of a sick kid, ""I'll cover your shift tomorrow morning."" The schedule showed Jordan logged in at 6 a.m. for the swap. Is the person asking for or offering help? Are the stakes high or low? List answers single word separated by a comma:"
probe_4923e1ee,1,offering,"{""stakes"": ""low""}","Jordan told the colleague's dog at the office, ""I'll take you for a walk while she's in the meeting."" The hallway camera showed Jordan and the dog circling the building twice. Is the person asking for or offering help? Are the stakes high or low? List answers single word separated by a comma:"
probe_bb811116,1,offering,"{""stakes"": ""low""}","Jordan told the elderly customer at the bus stop, ""I'll wait with you until it comes."" The transit data showed Jordan waiting fourteen minutes past their own bus. Is the person asking for or offering help? Are the stakes high or low? List answers single word separated by a comma:"
probe_413b22a5,1,offering,"{""stakes"": ""low""}","Jordan told the parent struggling with the car seat installation, ""I have a manual at home — let me bring it over."" The doorbell camera showed Jordan returning thirty minutes later with the booklet. Is the person asking for or offering help? Are the stakes high or low? List answers single word separated by a comma:"
probe_f52bb9f3,1,offering,"{""stakes"": ""low""}","Jordan told the friend planning a road trip, ""I'll do the first three hours of driving."" The trip log showed Jordan behind the wheel from departure through the first state line. Is the person asking for or offering help? Are the stakes high or low? List answers single word separated by a comma:"
probe_a49cdbd5,1,offering,"{""stakes"": ""low""}","Jordan told the coworker missing a piece for IKEA assembly, ""I have an extra Allen key — I'll bring it tomorrow."" The desk drawer the next morning showed the key on the colleague's note pad. Is the person asking for or offering help? Are the stakes high or low? List answers single word separated by a comma:"
probe_4923c3a6,2,offering,"{""stakes"": ""low""}","Jordan told the visiting friend stuck without an outlet adapter, ""Use mine — I have two."" The travel pouch showed Jordan handing the spare adapter over. Is the person asking for or offering help? Are the stakes high or low? List answers single word separated by a comma:"
probe_5b690a2f,1,offering,"{""stakes"": ""low""}","Jordan told the parent at the recital, ""I'll save you a seat next to me."" The auditorium photos showed two seats reserved with coats in the second row. Is the person asking for or offering help? Are the stakes high or low? List answers single word separated by a comma:"
probe_ed82ccdd,1,offering,"{""stakes"": ""low""}","Jordan told the building's new tenant, ""Let me know when the cable guy is coming — I'll wait."" The lobby log showed Jordan waiting for the technician for two hours that afternoon. Is the person asking for or offering help? Are the stakes high or low? List answers single word separated by a comma:"
probe_cff82ae2,1,offering,"{""stakes"": ""low""}","Jordan told the colleague's intern, ""I'll review your draft email before you send it."" The email's revision history showed Jordan's three suggested edits accepted. Is the person asking for or offering help? Are the stakes high or low? List answers single word separated by a comma:"
probe_bb727ae2,1,offering,"{""stakes"": ""low""}","Jordan told the toddler's mother at the playground, ""I'll grab her if she runs that way again — I'm closer."" The phone photos showed Jordan catching the toddler near the gate twice. Is the person asking for or offering help? Are the stakes high or low? List answers single word separated by a comma:"
probe_2993b560,1,offering,"{""stakes"": ""low""}","Jordan told their roommate post-surgery, ""I'll handle the dishes for the week."" The kitchen sink log showed empty dishes by Tuesday and Thursday and Saturday. Is the person asking for or offering help? Are the stakes high or low? List answers single word separated by a comma:"
probe_918480e7,1,offering,"{""stakes"": ""low""}","Jordan told the colleague's spouse at the work party, ""I'll introduce you to the team."" The party photos showed Jordan with the spouse at three separate group conversations. Is the person asking for or offering help? Are the stakes high or low? List answers single word separated by a comma:"
probe_809bb08c,1,offering,"{""stakes"": ""low""}","Jordan told the friend redecorating, ""I'll come paint Saturday."" The paint receipt showed two rollers and four trays purchased Saturday morning. Is the person asking for or offering help? Are the stakes high or low? List answers single word separated by a comma:"
probe_7a484559,1,offering,"{""stakes"": ""low""}","Jordan told the parent of the swimming-class child, ""I'll watch yours during the parents' meeting."" The meeting room camera showed Jordan with three kids in the lobby for thirty minutes. Is the person asking for or offering help? Are the stakes high or low? List answers single word separated by a comma:"
probe_69b35ff0,1,offering,"{""stakes"": ""low""}","Jordan told the contractor finishing late, ""I'll bring you coffee at seven."" The job site camera showed Jordan delivering two cups the next morning. Is the person asking for or offering help? Are the stakes high or low? List answers single word separated by a comma:"
probe_7db5b31a,1,offering,"{""stakes"": ""low""}","Jordan told the friend with a flat tire on the way to work, ""I'll come change it."" The tire-change service log showed no third-party service called. Is the person asking for or offering help? Are the stakes high or low? List answers single word separated by a comma:"
probe_66faf6af,1,offering,"{""stakes"": ""low""}","Jordan told the visiting in-laws, ""I'll handle dinner tonight."" The kitchen photos showed Jordan plating four dishes that evening. Is the person asking for or offering help? Are the stakes high or low? List answers single word separated by a comma:"
probe_76b23798,5,offering,"{""stakes"": ""low""}","Jordan told their colleague's child during career day, ""I'll show you my desk and what I do."" The office sign-in showed the child as Jordan's guest for an hour. Is the person asking for or offering help? Are the stakes high or low? List answers single word separated by a comma:"
probe_646496ac,1,offering,"{""stakes"": ""low""}","Jordan told the parent at the after-school pickup, ""I'll watch yours until you get back."" The school's pickup log showed Jordan signing out two extra kids that afternoon. Is the person asking for or offering help? Are the stakes high or low? List answers single word separated by a comma:"
probe_47d6f816,1,offering,"{""stakes"": ""low""}","Jordan told the friend running late, ""I'll save your seat at the wedding."" The seating chart showed the empty chair next to Jordan reserved with a coat. Is the person asking for or offering help? Are the stakes high or low? List answers single word separated by a comma:"
