probe_id,cluster,label,categories_json,input_text
probe_64ba5c4e,2,asking,"{""stakes"": ""low""}","Jordan told the friend, ""Could you take my dog this weekend?"" The hotel booking showed Jordan staying at a no-pets venue for the conference. Is the person asking for or offering help? Are the stakes high or low? List answers single word separated by a comma:"
probe_7030eeac,2,asking,"{""stakes"": ""low""}","Jordan told the colleague, ""Could you take notes for me in the ten a.m.?"" The calendar showed Jordan double-booked at the same time. Is the person asking for or offering help? Are the stakes high or low? List answers single word separated by a comma:"
probe_f8020f2c,2,asking,"{""stakes"": ""low""}","Jordan told the neighbor, ""Could you water my plants for a few days?"" The travel itinerary showed a weekend trip from Friday to Tuesday. Is the person asking for or offering help? Are the stakes high or low? List answers single word separated by a comma:"
probe_99b217d0,2,asking,"{""stakes"": ""low""}","Jordan told the partner, ""Could you take the recycling out tonight?"" The trash schedule showed pickup the next morning. Is the person asking for or offering help? Are the stakes high or low? List answers single word separated by a comma:"
probe_ef3de693,2,asking,"{""stakes"": ""low""}","Jordan told the parent, ""Could you pick the kids up from soccer?"" The scheduled coaching pickup showed Jordan running thirty minutes late. Is the person asking for or offering help? Are the stakes high or low? List answers single word separated by a comma:"
probe_67ab6155,5,asking,"{""stakes"": ""low""}","Jordan told their friend, ""Could you give me the recipe for that pasta you made last week?"" The dinner club thread showed the friend's photo from the meal. Is the person asking for or offering help? Are the stakes high or low? List answers single word separated by a comma:"
probe_1cb047cc,5,asking,"{""stakes"": ""low""}","Jordan told the librarian, ""Could you renew this book for another two weeks?"" The library account showed the original due date the next day. Is the person asking for or offering help? Are the stakes high or low? List answers single word separated by a comma:"
probe_e65a30f0,5,asking,"{""stakes"": ""low""}","Jordan told the manager, ""Could I take Wednesday morning off?"" The school's parent-teacher conference schedule showed a 9 a.m. slot Jordan had reserved. Is the person asking for or offering help? Are the stakes high or low? List answers single word separated by a comma:"
probe_8b14586e,5,asking,"{""stakes"": ""low""}","Jordan told the teacher, ""Could I make up the quiz I missed yesterday?"" The attendance record showed Jordan absent the previous day for a documented illness. Is the person asking for or offering help? Are the stakes high or low? List answers single word separated by a comma:"
probe_ad7804be,5,asking,"{""stakes"": ""low""}","Jordan told the colleague, ""Could you bring an extra coffee tomorrow morning?"" The team chat showed the coffee shop near the office had been closed unexpectedly. Is the person asking for or offering help? Are the stakes high or low? List answers single word separated by a comma:"
probe_4d9c71f0,2,asking,"{""stakes"": ""low""}","Jordan told their sibling, ""Could you take dad to his appointment Thursday?"" The medical calendar showed Jordan's own work commitment overlapping. Is the person asking for or offering help? Are the stakes high or low? List answers single word separated by a comma:"
probe_12506b22,5,asking,"{""stakes"": ""low""}","Jordan told the receptionist, ""Could you fit me in for a haircut today?"" The salon's online booking showed an opening at 5:30 p.m. Is the person asking for or offering help? Are the stakes high or low? List answers single word separated by a comma:"
probe_53670d6b,2,asking,"{""stakes"": ""low""}","Jordan told the colleague, ""Could I get your input on these slides before tomorrow?"" The presentation deck showed Jordan's revisions still in progress. Is the person asking for or offering help? Are the stakes high or low? List answers single word separated by a comma:"
probe_20aa35d1,2,asking,"{""stakes"": ""low""}","Jordan told the friend, ""Could you give me a hand carrying these boxes inside?"" The car trunk showed five boxes from the IKEA pickup. Is the person asking for or offering help? Are the stakes high or low? List answers single word separated by a comma:"
probe_1b651855,5,asking,"{""stakes"": ""low""}","Jordan told the IT desk, ""Could you reset my email password?"" The login attempt log showed Jordan locked out after five failed attempts. Is the person asking for or offering help? Are the stakes high or low? List answers single word separated by a comma:"
probe_2d0bf164,5,asking,"{""stakes"": ""low""}","Jordan told the teacher, ""Could you sign my permission slip?"" The school folder showed the field trip slip needing parental and teacher signatures. Is the person asking for or offering help? Are the stakes high or low? List answers single word separated by a comma:"
probe_9b3967ef,2,asking,"{""stakes"": ""low""}","Jordan told the partner, ""Could you take Pilot to the vet for his shots?"" The reminder card on the fridge showed the appointment Friday morning during Jordan's travel. Is the person asking for or offering help? Are the stakes high or low? List answers single word separated by a comma:"
probe_aa44ebc0,2,asking,"{""stakes"": ""low""}","Jordan told the friend, ""Could you check the scoreboard for me? I missed it."" The phone showed Jordan in a tunnel with the live update lost. Is the person asking for or offering help? Are the stakes high or low? List answers single word separated by a comma:"
probe_f40fca18,2,asking,"{""stakes"": ""low""}","Jordan told the building super, ""Could you take a look at the window? It won't shut."" The maintenance request log showed the existing entry from two weeks earlier. Is the person asking for or offering help? Are the stakes high or low? List answers single word separated by a comma:"
probe_a7ef2e44,5,asking,"{""stakes"": ""low""}","Jordan told the manager, ""Could I move my one-on-one to next week?"" The conflict on Jordan's calendar showed the mandatory training overlap. Is the person asking for or offering help? Are the stakes high or low? List answers single word separated by a comma:"
probe_90e04a06,5,asking,"{""stakes"": ""low""}","Jordan told the colleague, ""Could you forward me the deck from yesterday's meeting?"" Jordan's inbox showed no record of the original distribution. Is the person asking for or offering help? Are the stakes high or low? List answers single word separated by a comma:"
probe_4ed1504a,2,asking,"{""stakes"": ""low""}","Jordan told the parent, ""Could you bring my charger when you come over?"" The phone showed Jordan at fifteen percent and no charger at the rental. Is the person asking for or offering help? Are the stakes high or low? List answers single word separated by a comma:"
probe_ce1d58fb,2,asking,"{""stakes"": ""low""}","Jordan told their cousin, ""Could you cover for me at the family dinner Sunday?"" The travel calendar showed Jordan at a friend's wedding three states away. Is the person asking for or offering help? Are the stakes high or low? List answers single word separated by a comma:"
probe_144b1e45,5,asking,"{""stakes"": ""low""}","Jordan told the receptionist, ""Could you let me know when the doctor is ready?"" The clinic queue showed Jordan two patients out from being seen. Is the person asking for or offering help? Are the stakes high or low? List answers single word separated by a comma:"
probe_75d7e718,3,offering,"{""stakes"": ""high""}","Jordan told the older woman who had fallen, ""I'll call an ambulance and stay with you until they arrive."" The dispatch log showed Jordan's number connecting at 7:14 p.m. and the unit arriving at 7:23. Is the person asking for or offering help? Are the stakes high or low? List answers single word separated by a comma:"
probe_299537c6,3,offering,"{""stakes"": ""high""}","Jordan told the bystander on the bridge, ""Step back from the railing — I'll walk you somewhere safe."" The crisis response report showed Jordan on scene for forty-five minutes until the trained team arrived. Is the person asking for or offering help? Are the stakes high or low? List answers single word separated by a comma:"
probe_b73c7880,3,offering,"{""stakes"": ""high""}","Jordan told the unhoused man during the cold snap, ""Take my coat and let me drive you to the warming center."" The shelter intake showed the man arriving wearing Jordan's jacket at 2:18 a.m. Is the person asking for or offering help? Are the stakes high or low? List answers single word separated by a comma:"
probe_3ee98461,3,offering,"{""stakes"": ""high""}","Jordan told the new immigrant family, ""I'll go with you to the asylum interview and translate."" The USCIS interpreter form showed Jordan as the family's listed translator. Is the person asking for or offering help? Are the stakes high or low? List answers single word separated by a comma:"
probe_715575c4,3,offering,"{""stakes"": ""high""}","Jordan told the assault victim in the ER, ""I'll wait with you until your mother arrives."" The hospital visitor log showed Jordan present from intake through 1:42 a.m. Is the person asking for or offering help? Are the stakes high or low? List answers single word separated by a comma:"
probe_b36fc10b,3,offering,"{""stakes"": ""high""}","Jordan told the collapsed jogger, ""I know CPR — I'm starting compressions now."" The 911 call recording showed Jordan's voice counting compressions for nearly seven minutes until paramedics arrived. Is the person asking for or offering help? Are the stakes high or low? List answers single word separated by a comma:"
probe_6a5b0eec,1,offering,"{""stakes"": ""high""}","Jordan told the person at the bus stop in the rain, ""I'm going your direction — let me drive you home."" The rideshare records showed Jordan's car detoured eight miles to the passenger's address. Is the person asking for or offering help? Are the stakes high or low? List answers single word separated by a comma:"
probe_7aab299a,4,offering,"{""stakes"": ""high""}","Jordan told the witness to the hit-and-run, ""I have the license plate written down — let me give it to the officer with you."" The police report showed Jordan as the recording witness on the stand. Is the person asking for or offering help? Are the stakes high or low? List answers single word separated by a comma:"
probe_0018a192,3,offering,"{""stakes"": ""high""}","Jordan told the family of the dying patient, ""I'll cover the rest of the funeral costs."" The funeral home invoice showed a payment from Jordan covering the outstanding balance. Is the person asking for or offering help? Are the stakes high or low? List answers single word separated by a comma:"
probe_69a79019,3,offering,"{""stakes"": ""high""}","Jordan told the abuse survivor, ""Stay with us until you find a place — we have the spare room."" The household records showed the survivor at Jordan's address for six weeks. Is the person asking for or offering help? Are the stakes high or low? List answers single word separated by a comma:"
probe_0b76ab6a,3,offering,"{""stakes"": ""high""}","Jordan told the elderly veteran, ""I'll drive you to your VA appointment every week until your wife is back."" The transport log at the clinic showed Jordan signing in for fourteen consecutive weeks. Is the person asking for or offering help? Are the stakes high or low? List answers single word separated by a comma:"
probe_f121c450,3,offering,"{""stakes"": ""high""}","Jordan told the suicidal coworker, ""I'll go with you to the crisis center right now."" The intake record at the center showed Jordan as the accompanying party at 11:23 p.m. Is the person asking for or offering help? Are the stakes high or low? List answers single word separated by a comma:"
probe_1b777781,3,offering,"{""stakes"": ""high""}","Jordan told the disaster volunteer coordinator, ""I can lead a search team in the south sector."" The team assignment roster showed Jordan as the team lead for sector C. Is the person asking for or offering help? Are the stakes high or low? List answers single word separated by a comma:"
probe_6be5709f,4,offering,"{""stakes"": ""high""}","Jordan told the foster mother, ""I'll watch the children while you take the new placement to court."" The custody hearing schedule showed Jordan present at the home from 8 a.m. through 4:30 p.m. Is the person asking for or offering help? Are the stakes high or low? List answers single word separated by a comma:"
probe_46ad687e,4,offering,"{""stakes"": ""high""}","Jordan told the harassed waitress at the next table, ""I saw what he did — I'll back you up if you report it."" The complaint to management showed Jordan as the corroborating witness on the same evening. Is the person asking for or offering help? Are the stakes high or low? List answers single word separated by a comma:"
probe_f68372ed,4,offering,"{""stakes"": ""high""}","Jordan told the teen at the shelter, ""I'll testify at your custody hearing about what I saw at home."" The court transcript showed Jordan as a sworn fact witness. Is the person asking for or offering help? Are the stakes high or low? List answers single word separated by a comma:"
probe_c045f189,3,offering,"{""stakes"": ""high""}","Jordan told the patient's family in the ICU, ""I'll cover the night shift so you can sleep."" The visitor log showed Jordan at the bedside from 11 p.m. through 7 a.m. Is the person asking for or offering help? Are the stakes high or low? List answers single word separated by a comma:"
probe_145bfa00,3,offering,"{""stakes"": ""high""}","Jordan told the collapsed senior on the trail, ""I'll stay with you and signal the ranger from the ridge."" The SAR report showed Jordan giving GPS coordinates and remaining with the senior until the helicopter arrived. Is the person asking for or offering help? Are the stakes high or low? List answers single word separated by a comma:"
probe_bbbf8084,4,offering,"{""stakes"": ""high""}","Jordan told the wrongly-accused colleague, ""I'll talk to the investigator and tell them what actually happened."" The investigation file showed Jordan's signed statement contradicting the original report. Is the person asking for or offering help? Are the stakes high or low? List answers single word separated by a comma:"
probe_098f5ff7,4,offering,"{""stakes"": ""high""}","Jordan told the trans teen who'd been kicked out, ""Stay in the spare room as long as you need."" The mailing address records showed the teen receiving school correspondence at Jordan's address for the school year. Is the person asking for or offering help? Are the stakes high or low? List answers single word separated by a comma:"
probe_e9f24d92,3,offering,"{""stakes"": ""high""}","Jordan told the parents of the injured child, ""I have my car at the curb — let me drive you to the children's hospital."" The ER admission record showed the child arriving with Jordan as the listed transport. Is the person asking for or offering help? Are the stakes high or low? List answers single word separated by a comma:"
probe_117e1abd,3,offering,"{""stakes"": ""high""}","Jordan told the small business owner during the closure, ""I'll cover payroll this week — you keep your people."" The bank wire showed twelve thousand dollars sent from Jordan's account to the business that Friday. Is the person asking for or offering help? Are the stakes high or low? List answers single word separated by a comma:"
probe_72c08462,3,offering,"{""stakes"": ""high""}","Jordan told the survivor of the crash, ""Don't move — I'll keep your spine stable until they get here."" The trauma surgeon's notes showed manual cervical stabilization documented as initiated on scene. Is the person asking for or offering help? Are the stakes high or low? List answers single word separated by a comma:"
probe_df400a7e,4,offering,"{""stakes"": ""high""}","Jordan told the displaced family at the wildfire shelter, ""Take our spare bedroom until you can find a place."" The household showed three additional residents on the property records for six weeks. Is the person asking for or offering help? Are the stakes high or low? List answers single word separated by a comma:"
probe_a6977dca,3,offering,"{""stakes"": ""high""}","Jordan told the new ostomy patient, ""I had this surgery five years ago — I'll show you everything."" The peer support log showed Jordan returning to the hospital seven times to coach the patient. Is the person asking for or offering help? Are the stakes high or low? List answers single word separated by a comma:"
probe_86c326bc,3,offering,"{""stakes"": ""high""}","Jordan told the family of the comatose patient, ""I'll sit with him so you can go home."" The hospital visitor sign-in sheet showed Jordan's signature for thirteen overnight shifts. Is the person asking for or offering help? Are the stakes high or low? List answers single word separated by a comma:"
probe_dc1074cb,4,offering,"{""stakes"": ""high""}","Jordan told the asylum seeker at the airport, ""I'll be your sponsor — I'll sign whatever they need."" The I-134 affidavit showed Jordan as the financial sponsor. Is the person asking for or offering help? Are the stakes high or low? List answers single word separated by a comma:"
probe_9f94c542,1,offering,"{""stakes"": ""high""}","Jordan told the woman fleeing across the parking lot, ""Get in my car — I'll drive you to the police station."" The dashcam footage showed the woman in the passenger seat as the car left the lot. Is the person asking for or offering help? Are the stakes high or low? List answers single word separated by a comma:"
probe_35dc1410,3,offering,"{""stakes"": ""high""}","Jordan told the teen who'd disclosed abuse, ""I'll come with you when you tell the school counselor."" The mandated report log showed Jordan present as the supportive adult during the disclosure. Is the person asking for or offering help? Are the stakes high or low? List answers single word separated by a comma:"
probe_019728de,3,offering,"{""stakes"": ""high""}","Jordan told the elderly couple after the break-in, ""Stay with me tonight — I'll handle the police report and the insurance call."" The police report showed Jordan as the present third party and the couple's listed contact for follow-up. Is the person asking for or offering help? Are the stakes high or low? List answers single word separated by a comma:"
probe_eb4bc703,3,offering,"{""stakes"": ""high""}","Jordan told the unconscious driver, ""Stay still — I have you."" The body camera footage from the responding officer showed Jordan kneeling beside the driver maintaining airway position. Is the person asking for or offering help? Are the stakes high or low? List answers single word separated by a comma:"
probe_c628c2b4,3,offering,"{""stakes"": ""high""}","Jordan told the recently widowed neighbor, ""I'll handle the lawn and the snow this winter."" The neighborhood association showed Jordan as the handled-property contact for the next six months. Is the person asking for or offering help? Are the stakes high or low? List answers single word separated by a comma:"
probe_860a4f3c,3,offering,"{""stakes"": ""high""}","Jordan told the woman whose card had been declined, ""Let me cover this — pay me back when you can."" The grocery store receipt showed Jordan's card covering the family's full week of food. Is the person asking for or offering help? Are the stakes high or low? List answers single word separated by a comma:"
probe_43f62686,3,offering,"{""stakes"": ""high""}","Jordan told the homeless veteran on Christmas Eve, ""Come home with me — there's room at the table."" The community center registry showed Jordan adding a guest to the roster for the holiday meal. Is the person asking for or offering help? Are the stakes high or low? List answers single word separated by a comma:"
probe_b32fa53d,3,offering,"{""stakes"": ""high""}","Jordan told the parents of the missing child, ""I have a four-wheel drive — I can search the back roads."" The search coordinator's log showed Jordan covering routes A through D from midnight until dawn. Is the person asking for or offering help? Are the stakes high or low? List answers single word separated by a comma:"
probe_6a107500,3,offering,"{""stakes"": ""high""}","Jordan told the adult child whose parent was hospitalized far from home, ""I'll bring meals to your father every day until you can fly back."" The hospital cafeteria sign-in showed Jordan visiting the patient's room daily for two weeks. Is the person asking for or offering help? Are the stakes high or low? List answers single word separated by a comma:"
probe_45123168,4,offering,"{""stakes"": ""high""}","Jordan told the sexual assault survivor, ""I'll come to the police interview as your support person."" The detective's notes showed Jordan present in the interview room during the official statement. Is the person asking for or offering help? Are the stakes high or low? List answers single word separated by a comma:"
probe_fa50e4a9,3,offering,"{""stakes"": ""high""}","Jordan told the friend in foreclosure, ""Move in with us until you're back on your feet."" The household records showed the friend and her child residing at Jordan's address for nine months. Is the person asking for or offering help? Are the stakes high or low? List answers single word separated by a comma:"
probe_dd9348e1,1,offering,"{""stakes"": ""high""}","Jordan told the neighbor who'd lost her son, ""I'll arrange the meals for the next month."" The community sign-up showed Jordan as the coordinator with twenty-eight meals scheduled. Is the person asking for or offering help? Are the stakes high or low? List answers single word separated by a comma:"
probe_aa9e0d63,4,offering,"{""stakes"": ""high""}","Jordan told the colleague being deported, ""I'll go to the detention hearing and submit a character letter."" The court file showed Jordan's notarized affidavit submitted forty-eight hours before the hearing. Is the person asking for or offering help? Are the stakes high or low? List answers single word separated by a comma:"
probe_b2028f77,1,offering,"{""stakes"": ""high""}","Jordan told the toddler's mother at the train station, ""Take my stroller — I'm done with mine."" The donation log at the station showed Jordan handing over the stroller and receipt of thanks. Is the person asking for or offering help? Are the stakes high or low? List answers single word separated by a comma:"
probe_342995fe,4,offering,"{""stakes"": ""high""}","Jordan told the survivor of the assault, ""I'll testify for you — I was at the bar that night."" The witness list filed by the prosecution showed Jordan as a confirmed trial witness. Is the person asking for or offering help? Are the stakes high or low? List answers single word separated by a comma:"
probe_3481776b,3,offering,"{""stakes"": ""high""}","Jordan told the new widower, ""I'll handle calling everyone for you."" The phone records showed Jordan placing forty-three outgoing calls to family and friends over four hours that day. Is the person asking for or offering help? Are the stakes high or low? List answers single word separated by a comma:"
probe_117c5912,3,offering,"{""stakes"": ""high""}","Jordan told the immigrant grandmother, ""I'll go to your medical appointments and translate."" The clinic interpreter log showed Jordan attending twelve appointments over six months. Is the person asking for or offering help? Are the stakes high or low? List answers single word separated by a comma:"
probe_d68bf4b5,3,offering,"{""stakes"": ""high""}","Jordan told the child at the protest, ""Stay close to me — I'll get you to your parents."" The march coordinator's log showed Jordan returning the child to the family at the rally point. Is the person asking for or offering help? Are the stakes high or low? List answers single word separated by a comma:"
probe_a16ebb8e,3,offering,"{""stakes"": ""high""}","Jordan told the neighbor whose pipe had burst, ""Take what you need from our basement until you can dry out."" The landlord's incident report showed Jordan's basement listed as the temporary storage for the affected unit. Is the person asking for or offering help? Are the stakes high or low? List answers single word separated by a comma:"
probe_706d8d5a,3,offering,"{""stakes"": ""high""}","Jordan told the cancer patient newly diagnosed, ""I'll drive you to every chemo appointment."" The infusion center sign-in showed Jordan's signature for twenty-two of twenty-four scheduled sessions. Is the person asking for or offering help? Are the stakes high or low? List answers single word separated by a comma:"
probe_b923dde4,4,offering,"{""stakes"": ""high""}","Jordan told the trans teen's parents, ""Send him to our place if you're not safe at home."" The address change with the school showed the teen's listed residence as Jordan's home for the school year. Is the person asking for or offering help? Are the stakes high or low? List answers single word separated by a comma:"
probe_65f00143,1,offering,"{""stakes"": ""high""}","Jordan told the elderly woman lost downtown, ""I'll drive you home — what's the address?"" The home check-in by the family showed Jordan dropping the woman safely at her front door. Is the person asking for or offering help? Are the stakes high or low? List answers single word separated by a comma:"
probe_f8410f01,0,offering,"{""stakes"": ""high""}","Jordan told the parents of the deployed soldier, ""We've got the lawn and the bills until he comes back."" The household budget showed eight months of mortgage payments handled from Jordan's account. Is the person asking for or offering help? Are the stakes high or low? List answers single word separated by a comma:"
